{
  "schemaVersion": 1,
  "name": "business-tool-mvp",
  "description": "Example: internal business tool (offer calculation, forecast, time tracking, monthly report) from requirements document to acceptance.",
  "inputs": [
    "docs/input/produktvision.md"
  ],
  "rules": {
    "maxRounds": 3,
    "maxParallelAgents": 4,
    "models": {
      "build": "opus",
      "review": "opus"
    },
    "delivery": "pr-merge",
    "baseBranch": "main",
    "preCommit": "npm run check",
    "worktrees": true,
    "readOnly": [
      "docs/input/"
    ],
    "notes": [
      "Open questions and contradictions in the inputs are recorded as open questions in the phase's decision log."
    ],
    "humanInTheLoop": "as-needed",
    "askHumanWhen": [
      "A contradiction with or gap in docs/input/",
      "A change of the MVP scope",
      "Prices, hourly rates, margins or other money amounts",
      "Anything that affects how customers are billed"
    ],
    "consult": {
      "enabled": true,
      "maxPerRound": 3
    }
  },
  "phases": [
    {
      "id": "requirements",
      "goal": "Turn the MVP scope from the product vision into testable requirements.",
      "dependsOn": [],
      "inputs": [
        "docs/input/produktvision.md"
      ],
      "participants": [
        {
          "agent": "product-manager",
          "mode": "build",
          "task": "Derive user stories and requirements with IDs and acceptance criteria from the product vision.",
          "focus": [
            "Customers and hourly rates",
            "Offer calculation",
            "Time tracking",
            "Forecast",
            "Monthly report",
            "Login with a shared password"
          ],
          "outputs": [
            "docs/specification/requirements.md"
          ]
        },
        {
          "agent": "consultant-user",
          "mode": "review",
          "task": "Check whether the time tracking requirements work quickly and with few errors in everyday use.",
          "focus": [
            "Week view",
            "Booking after the fact",
            "Corrections",
            "Wrong bookings"
          ]
        },
        {
          "agent": "controller",
          "mode": "review",
          "task": "Check whether calculation, forecast and reports are fully specified from a business point of view.",
          "focus": [
            "Risk buffer and discount",
            "Fixed price vs. time and materials",
            "Plan vs. actual comparison"
          ]
        },
        {
          "agent": "project-manager",
          "mode": "review",
          "task": "Check that the scope stays within the MVP and nothing from the 'Nicht im MVP' (not in the MVP) section has slipped in.",
          "focus": [
            "Scope",
            "Prioritization",
            "Open questions"
          ]
        }
      ],
      "acceptance": [
        "Every feature of the product vision is covered by at least one requirement with an ID.",
        "Every requirement has verifiable acceptance criteria.",
        "Nothing from 'Nicht im MVP' (not in the MVP) is included.",
        "Assumptions from the product vision are adopted or resolved as an open question in the decisionLog."
      ]
    },
    {
      "id": "calculation-forecast",
      "goal": "Define the calculation rules for offer calculation, forecast and monthly report precisely.",
      "dependsOn": [
        "requirements"
      ],
      "inputs": [
        "docs/input/produktvision.md",
        "docs/specification/requirements.md"
      ],
      "participants": [
        {
          "agent": "controller",
          "mode": "build",
          "task": "Describe every formula for calculation, forecast and metrics with its rounding rule and at least one worked example.",
          "focus": [
            "Offer price",
            "Spreading fixed prices across months",
            "Revenue per month",
            "Plan vs. actual variance",
            "Margin"
          ],
          "outputs": [
            "docs/specification/calculation-forecast.md"
          ]
        },
        {
          "agent": "tester",
          "mode": "review",
          "task": "Check that every formula is unambiguous and testable.",
          "focus": [
            "Rounding",
            "Month boundaries",
            "Zero and boundary values"
          ]
        },
        {
          "agent": "product-manager",
          "mode": "review",
          "task": "Check that the calculation rules cover the requirements completely and add no extra scope."
        }
      ],
      "acceptance": [
        "Every formula has an example with concrete numbers and a result.",
        "Rounding rules and when rounding happens are defined.",
        "No open questions about calculation rules remain."
      ]
    },
    {
      "id": "billing-rules",
      "goal": "Define when and at what value booked time is billed.",
      "dependsOn": [
        "requirements"
      ],
      "inputs": [
        "docs/input/produktvision.md",
        "docs/specification/requirements.md"
      ],
      "participants": [
        {
          "agent": "billing",
          "mode": "build",
          "task": "Describe the rules for billable time, hourly rate validity, billing against fixed-price budgets and month-end closing, each with examples.",
          "focus": [
            "Directly billable",
            "Fixed-price budget consumption",
            "Budget overrun",
            "Rate change on a cutoff date",
            "Lock after month-end closing"
          ],
          "outputs": [
            "docs/specification/billing-rules.md"
          ]
        },
        {
          "agent": "tester",
          "mode": "review",
          "task": "Check that every rule is unambiguous and testable.",
          "focus": [
            "Cutoff dates",
            "Month boundaries",
            "Corrections after closing"
          ]
        },
        {
          "agent": "controller",
          "mode": "review",
          "task": "Check that the billing rules are consistent with the revenue metrics and the forecast."
        }
      ],
      "acceptance": [
        "Every rule has at least one example with a result.",
        "For every booking it is unambiguous whether and at what value it is billed.",
        "Month-end closing and its consequences are fully described."
      ]
    },
    {
      "id": "views",
      "goal": "Describe pages, user flows and charts.",
      "dependsOn": [
        "requirements"
      ],
      "inputs": [
        "docs/specification/requirements.md"
      ],
      "participants": [
        {
          "agent": "ux-dataviz",
          "mode": "build",
          "task": "Describe every page with its purpose, content, filters and states, and choose the chart types for the dashboard.",
          "focus": [
            "Time tracking week view",
            "Offer editor",
            "Forecast entry",
            "Monthly dashboard",
            "Plan vs. actual over time"
          ],
          "outputs": [
            "docs/ux/views.md"
          ]
        },
        {
          "agent": "consultant-user",
          "mode": "review",
          "task": "Walk through daily time booking and preparing an offer using the views.",
          "focus": [
            "Click paths",
            "Keyboard use",
            "Time spent"
          ]
        },
        {
          "agent": "controller",
          "mode": "review",
          "task": "Check that the dashboard shows the metrics correctly and not misleadingly."
        }
      ],
      "acceptance": [
        "Every requirement with a user interface is assigned to a view.",
        "Every chart states the question it answers, its data source and its unit.",
        "Empty, loading and error states are described."
      ]
    },
    {
      "id": "security-concept",
      "goal": "Define login, data protection and privacy requirements.",
      "dependsOn": [
        "requirements"
      ],
      "inputs": [
        "docs/specification/requirements.md"
      ],
      "participants": [
        {
          "agent": "privacy-security",
          "mode": "build",
          "task": "Define the security and privacy requirements with IDs. There are no users and no roles, only a single shared password read from a file on the server.",
          "focus": [
            "Storing and checking the password",
            "Sessions and logout",
            "Brute-force protection",
            "Protecting confidential figures in transit and in backups",
            "OWASP Top 10"
          ],
          "outputs": [
            "docs/specification/security.md"
          ]
        },
        {
          "agent": "product-manager",
          "mode": "review",
          "task": "Check that the security requirements fit the product vision and block no feature. Users and roles are not part of the MVP."
        }
      ],
      "acceptance": [
        "Every security requirement has an ID and is testable.",
        "The concept introduces no users, roles or user management."
      ]
    },
    {
      "id": "data-model",
      "goal": "Derive the PostgreSQL data model from the business rules.",
      "dependsOn": [
        "calculation-forecast",
        "billing-rules",
        "security-concept"
      ],
      "inputs": [
        "docs/specification/requirements.md",
        "docs/specification/calculation-forecast.md",
        "docs/specification/billing-rules.md",
        "docs/specification/security.md"
      ],
      "participants": [
        {
          "agent": "database-expert",
          "mode": "build",
          "task": "Design tables, types, constraints and indexes, and enforce the business rules in the database wherever possible.",
          "focus": [
            "numeric for money",
            "Hourly rate history",
            "Locking closed months",
            "Aggregation per month"
          ],
          "outputs": [